{
  "$schema": "https://json-schema.org/draft/2020-12/schema",
  "$id": "https://local.harness/agent-task-contract.schema.json",
  "title": "Agent Task Contract",
  "type": "object",
  "additionalProperties": false,
  "required": [
    "task_id",
    "objective",
    "workspace_root",
    "mode",
    "scope",
    "required_commands",
    "success_criteria",
    "stop_conditions",
    "approval_gates"
  ],
  "properties": {
    "task_id": {
      "type": "string",
      "minLength": 1
    },
    "objective": {
      "type": "string",
      "minLength": 1
    },
    "workspace_root": {
      "type": "string",
      "minLength": 1
    },
    "mode": {
      "type": "string",
      "enum": ["autonomous", "interactive"]
    },
    "scope": {
      "type": "object",
      "additionalProperties": false,
      "required": ["allowed_paths", "forbidden_paths", "max_files_to_edit"],
      "properties": {
        "allowed_paths": {
          "type": "array",
          "minItems": 1,
          "items": {
            "type": "string",
            "minLength": 1
          }
        },
        "forbidden_paths": {
          "type": "array",
          "items": {
            "type": "string",
            "minLength": 1
          }
        },
        "max_files_to_edit": {
          "type": "integer",
          "minimum": 1
        }
      }
    },
    "required_commands": {
      "type": "array",
      "minItems": 1,
      "items": {
        "type": "string",
        "minLength": 1
      }
    },
    "environment_prerequisites": {
      "type": "array",
      "items": {
        "type": "string",
        "minLength": 1
      }
    },
    "preflight_commands": {
      "type": "array",
      "items": {
        "type": "string",
        "minLength": 1
      }
    },
    "success_criteria": {
      "type": "array",
      "minItems": 1,
      "items": {
        "type": "string",
        "minLength": 1
      }
    },
    "stop_conditions": {
      "type": "array",
      "minItems": 1,
      "items": {
        "type": "string",
        "minLength": 1
      }
    },
    "approval_gates": {
      "type": "array",
      "minItems": 1,
      "items": {
        "type": "string",
        "minLength": 1
      }
    },
    "deliverables": {
      "type": "array",
      "items": {
        "type": "string",
        "minLength": 1
      }
    },
    "notes": {
      "type": "array",
      "items": {
        "type": "string",
        "minLength": 1
      }
    }
  }
}