{
  "task_id": "T7-T8-raw-capture-pipeline",
  "objective": "Implement the raw capture intake and classification application flows so text, manual form, and audio inputs are persisted before extraction and can later receive stored classification results with confidence and parse version.",
  "workspace_root": ".",
  "mode": "autonomous",
  "scope": {
    "allowed_paths": [
      "mobile/field_work_agent/lib/core",
      "mobile/field_work_agent/lib/features",
      "examples/task-contracts"
    ],
    "forbidden_paths": [
      "AGENTS.md",
      "PLANS.md",
      "docs",
      "schemas",
      "mobile/field_work_agent/lib/app",
      "mobile/field_work_agent/lib/data/database/migrations"
    ],
    "max_files_to_edit": 10
  },
  "required_commands": [
    "make task-contract CONTRACT=examples/task-contracts/t7-t8-raw-capture-pipeline.json",
    "make ci",
    "make audit"
  ],
  "success_criteria": [
    "A raw capture intake service exists for pasted text, manual form drafts, and audio-start events.",
    "Raw captures are persisted before later extraction or review flows mutate them.",
    "Classification results can be stored with type, confidence, and parse version.",
    "Classification falls back safely to unknown instead of crashing on unsupported values."
  ],
  "stop_conditions": [
    "The task requires UI shell or platform recording APIs.",
    "The task requires schema changes outside the current raw_captures table.",
    "The task requires remote services rather than local application flows."
  ],
  "approval_gates": [
    "Adding platform recorder integration",
    "Changing schema instead of implementing on the current raw capture model"
  ],
  "deliverables": [
    "Content hash helper",
    "Raw capture intake service",
    "Capture classification service"
  ],
  "notes": [
    "Ticket sources: docs/implementation-tickets.md T7 and T8.",
    "Keep the flow local-only and preserve captures before later parsing or extraction."
  ]
}